{
  "releaseSet": "dpp-release-2026-09-2",
  "status": "candidate",
  "description": "The second candidate set of September 2026: the packages of dpp-release-2026-09 with the interoperability additions of the GS1 discovery, EPCIS source exchange, external ecdsa-rdfc-2019 credential and passport projection profiles, and the draft battery@3 and textile@3 successors carried as opt-in versions beside the unchanged battery@2 and textile@2. @bsv/dpp-profiles moves to 0.3.0 (new helpers, manifests, schemas and its first runtime dependency, the RFC 8785 canonicaliser, recorded with the maintained P-256 suite in conformance/licences.json rather than as part of the shared stack baseline) and @bsv/vsc to 0.2.0 (the epcis-source and exchange entry points with the maintained P-256 Data Integrity suite); @bsv/dpp-core and @bsv/dpp-overlay-topics are unchanged at 0.3.0. Wire contracts, the custody profile and the runtime baseline are those of the first set. Candidate until the packages are published under the versions named here.",
  "baseline": "native-baseline@2",
  "runtime": {
    "node": ">=22",
    "dependencies": [
      {
        "name": "@bsv/sdk",
        "version": "2.4.2"
      },
      {
        "name": "@bsv/overlay",
        "version": "2.3.1",
        "note": "resolves @bsv/gasp 1.3.6; consumed by @bsv/dpp-overlay-topics only"
      },
      {
        "name": "mongodb",
        "version": "7.5.0",
        "note": "the reference persistence of the index node, replaceable"
      },
      {
        "name": "@bsv/wallet-toolbox-client",
        "version": "2.11.0",
        "note": "the application service's wallet, not a dependency of any package here"
      }
    ]
  },
  "packages": [
    {
      "name": "@bsv/dpp-core",
      "version": "0.3.0",
      "directory": "packages/dpp-core",
      "role": "the record model (both versions), signatures, chain verification, the verification report, the native claim, the generic anchor, the managed acceptance record, publisher policy and evidence packages",
      "entryPoints": [
        "."
      ],
      "carries": [
        "dist"
      ]
    },
    {
      "name": "@bsv/dpp-overlay-topics",
      "version": "0.3.0",
      "directory": "packages/overlay-topics",
      "role": "the topic managers, lookup services, storage adapters, capabilities, history, export, retraction and synchronisation of the index, as a library; the node itself ships as the image",
      "entryPoints": [
        "."
      ],
      "carries": [
        "dist"
      ],
      "serverOnly": true
    },
    {
      "name": "@bsv/dpp-profiles",
      "version": "0.3.0",
      "directory": "packages/dpp-profiles",
      "role": "the industry, exchange and operator profiles as frozen manifests with generated schemas and consumer documents, the lifecycle mapping for both record versions, and the GS1 identifier helpers; the GS1 discovery helpers, the interoperability manifests, the shared evidence shapes, the declarative applicability evaluator and the deterministic passport projection",
      "entryPoints": [
        ".",
        "./manifests/*",
        "./schemas/*",
        "./generated/*",
        "./frozen.json"
      ],
      "carries": [
        "dist",
        "manifests",
        "schemas",
        "generated",
        "frozen.json"
      ]
    },
    {
      "name": "@bsv/vsc",
      "version": "0.2.0",
      "directory": "packages/vsc",
      "role": "the VSC draft compatibility profile with its owned context and schema artefacts and the two proof suites; the EPCIS source helpers with the pinned EPCIS 2.0.1 artefacts (./epcis-source) and the external ecdsa-rdfc-2019 credential verifier (./exchange)",
      "entryPoints": [
        ".",
        "./exchange",
        "./epcis-source",
        "./artifacts/*"
      ],
      "carries": [
        "dist",
        "artifacts"
      ]
    }
  ],
  "wire": {
    "records": [
      {
        "version": "1",
        "fieldCount": 14,
        "protocolId": [
          1,
          "dpp token v1"
        ],
        "specification": "spec/record-model.md"
      },
      {
        "version": "2",
        "fieldCount": 17,
        "protocolId": [
          1,
          "dpp token v2"
        ],
        "specification": "spec/record-model-v2.md"
      }
    ],
    "nativeClaim": "dpp-lifecycle-v1",
    "anchor": "bsv-attestation-anchor-v1",
    "acceptanceRecord": "dpp-managed-acceptance@1",
    "verificationReport": "1",
    "overlayContract": "0.6.0-draft"
  },
  "custody": {
    "selected": "managed-custody@1",
    "profile": "custody",
    "specification": "spec/managed-custody.md",
    "alsoSupported": [
      "record-model-baseline@2",
      "owner-signed transfer (spec/custody.md section 4) for version 1 lineages"
    ]
  },
  "serviceInterface": {
    "package": "@dpp/service",
    "version": "0.2.0",
    "repository": "bsv-blockchain-demos/dpp-app",
    "entryPoints": [
      ".",
      "./verify",
      "./server"
    ],
    "operations": [
      "issue",
      "update",
      "offer",
      "accept",
      "decline",
      "retire",
      "upgrade",
      "status",
      "operation",
      "settle",
      "verify",
      "exportEvidence"
    ],
    "note": "PassportService in the application repository is the account-agnostic entry point over the writer's journal; it consumes the packages above and is not itself published in this set."
  },
  "artefacts": [
    {
      "path": "conformance/baseline-native-2.json",
      "sha256": "54255ec2088287560d4a59f78eefbb076d9e1396e35dd09a33afa451a6f672c4",
      "pins": "the baseline this set claims, with every fixture digest"
    },
    {
      "path": "contracts/overlay.yaml",
      "sha256": "c01ca3b54de2fba7ca2894a7e359e99856780cbe2e3c68dc7d2e058dad5dd0bb",
      "pins": "the index's HTTP contract"
    },
    {
      "path": "contracts/verification-report.schema.json",
      "sha256": "6c54bd1106a7a4aac5bdc0403453d292fc640d033a218b531c2ab35bc156b5ce",
      "pins": "the report schema and reason codes"
    },
    {
      "path": "contracts/capabilities.schema.json",
      "sha256": "2b9bcdab73627a146689c1eb73772cf7d7a6ad40d1e71d67046f63d4db9f66d8",
      "pins": "the capability document"
    },
    {
      "path": "packages/dpp-profiles/frozen.json",
      "sha256": "7138a3cb86615f7fed9b66ead25becb4adf303408080cd0cbe9db835c09eda3e",
      "pins": "the frozen profile manifests"
    },
    {
      "path": "contracts/interoperability.yaml",
      "sha256": "adc11c1a78ba67989956b72c4261b36943128f44468baea3ae9f01c93c627b6a",
      "pins": "the application interoperability API contract"
    },
    {
      "path": "contracts/epcis-import.schema.json",
      "sha256": "23c4167319c6b269a908426d6d23499fe8c19ab9949342f3de8e13b4885b4bdb",
      "pins": "the durable EPCIS import record"
    },
    {
      "path": "contracts/passport-source.schema.json",
      "sha256": "bfd9b06926b093f0cf8cd51dbcb9a5431d8a3656f058236166c9ef72003e2a78",
      "pins": "source revisions and relationships"
    },
    {
      "path": "contracts/passport-projection.schema.json",
      "sha256": "c489252c83fc3708f984dcbbff4b914cf20ada6ca47818b7ab89a2dbebd52ed9",
      "pins": "passport-projection@1"
    },
    {
      "path": "contracts/profile-evidence.schema.json",
      "sha256": "08d6521c4ae69860c940cfd4ee1e2c8f9f4a16a9f5dd951352037b32add91261",
      "pins": "the shared evidence, measurement, certification, document and language shapes"
    },
    {
      "path": "packages/dpp-profiles/schemas/interoperability-profile.schema.json",
      "sha256": "7a1dfd887af7b278b25c2a5d6f19c409790825da558416a9d55b2b7509fa922f",
      "pins": "the interoperability manifest contract"
    },
    {
      "path": "packages/dpp-profiles/schemas/profile-manifest-v2.schema.json",
      "sha256": "983284a926c7d3cfa814ca0b5179f42db85951230eb44afb7b79595c013a3a44",
      "pins": "the successor industry manifest contract"
    }
  ],
  "consumers": [
    {
      "name": "bsv-blockchain-demos/dpp-app",
      "consumes": "verbatim mirrors of packages/dpp-core, packages/overlay-topics, packages/dpp-profiles and packages/vsc pinned by blob hash (packages/STANDARD_MIRROR.json), to be replaced by the published packages of this set",
      "note": "the example consumer with the sector workflows"
    },
    {
      "name": "bsv-blockchain-demos/uora-bsv",
      "consumes": "the four packages as vendored tarballs, to be replaced by the published packages of this set"
    }
  ],
  "image": {
    "dockerfile": "packages/overlay-topics/Dockerfile",
    "preset": "deploy/compose.yml",
    "tag": "dpp-overlay:0.3.0"
  }
}
